<?xml version="1.0" encoding="UTF-8"?><IdmxProof xmlns="http://www.zurich.ibm.com/security/idemix" xmlns:xs="http://www.w3.org/2001/XMLSchema" xmlns:xsi="http://www.w3.org/2001/XMLSchema-instance" xsi:schemaLocation="http://www.zurich.ibm.com/security/idemix ../xsd/IdmxProof.xsd">
  <Challenge>100086052883614236316957067257254003415363624441589581736240462050569079714370</Challenge>
  <CommonValues>
    <CommonValue key="gp">78485280485625733211402793534323449321117898710088543846747559831834759431000</CommonValue>
    <CommonValue key="http://www.ngo.org/CredStruct5.xml;someRandomNameMatchingTheOneInTheProofSpec">20876415721204462178611417209769518444848369687557948765747924517908006097297371038138520154525933025523044385378455176827765465517689786301104788847772513640770065950238198225436892932810793068920183460445651703315776788012626562667077872190688337017126960466944260668043030855252638503334439431770023738606</CommonValue>
    <CommonValue key="http://www.ngo.org/CredStruct5.xml;someRandomNameMatchingTheOneInTheProofSpec;issuerPk">36208523169489658024847489255733158291125038638410703786015367110824921513092</CommonValue>
    <CommonValue key="id2;AND">74630161477421230398187833440738874727594016462004269952782597222669140931120687778342022311314091656602365658438926122711317931341495609162552075421878810160177097922285360082914309110589536547743937595721154829528393944831311495777981986541883364277150235135738434050517331934947496578303921478859208158562</CommonValue>
    <CommonValue key="proofSpecHash">106349760623976657391258455275446593014569806941402073194625287387317747806285</CommonValue>
    <CommonValue key="sp">19313454934015494502853372660485364277088851954979011267331898025266929871326</CommonValue>
  </CommonValues>
  <Values>
    <Value key="http://www.ngo.org/CredStruct5.xml;someRandomNameMatchingTheOneInTheProofSpec" type="SValueProveCL">
      <SValueProveCL>
        <eHat>-113587853526663340656424019393125160727358840778610157907720305818205104629039493882634196575958642043225485388447956758297488351383813214257933668584920799898092293354873473541</eHat>
        <vHatPrime>-13367923060853140189714719332427234207424585129410722273019839152430783997131696059542880761583185134899165792772074447585066509977953915504853406125362274997953616600926067579728040310361416432959310370044306627220697161639058600748154474285337197817293823984993321326167733560154359851676596306989232713658889110405308495257616916855519993512122447884056745674382297478711122092196566223576807487326988386719107650046617319376850954048432854212838571899914338322053516681840722521035866556196735541332978615824660867162187562609827991088560738596083471799258359435133678074974226662257</vHatPrime>
      </SValueProveCL>
    </Value>
    <Value key="id2;AND" type="SValueCGAND">
      <SValueCGAND>
        <mHat_h>26352845274621165023295559773121986241260659284123082461456220973090143376846131465973081509133368313900725367188076043262361110279860495569880530384638461284575</mHat_h>
        <rHat>-171752433079304347176633840572604432098794581164840893690490316743844442301910639168495983635628378986024165736923303051779298669808769696650019114137006969407755256684099014684960777891474786210331831460910001472475389433773526691485813916829296695678939985151789695273018526870662716408286228776678580317270523013232540763118641443225011097727331333059311509402576165525738844900437342506691535335370575187</rHat>
      </SValueCGAND>
    </Value>
    <Value key="id2" type="BigInteger">22376354118410204915579805457062817778316108561620837583903711693281346598190958774349634151091938397742760540821163197319707190671473936545330701041212425381453627682883143550</Value>
    <Value key="id1" type="BigInteger">8646061191778609275107809385831732124529826742820074978394664166563645992413355547395462381859290040236968682142667767990181621132227778745481990765611507122407126718678432678</Value>
  </Values>
  <TValues>
    <TValue>56547371442872540291045424446651213829818195627989552702303182556564957919335476291078855947071796430658433371748406922199218572460174604375825700210793680862518066551695156370346255268260426613462492904540214585715439686615860620466522516679147888922606163726044295411873522297765420525816726638003699538418</TValue>
    <TValue>47125991402712799127262216278368509353184725706128427540607278034049344825935457332311477261838490905678238656161523972368123202019200625615240891304170525130606591755799621021033144209498554565586815389301976223019196214027020792359076461765680415065178463111731953753189368805811694789821773838078043446227</TValue>
    <TValue>31213337340243773671993960970007078705556783098419679882963304644201825245752918921381346316324880054224170532802014227598864511105614946342976530426363340421083217167850547765671133532729313256304765688679214051353477484378431686985019815511209001666335464241382438349981760645452760172283844547545483689278</TValue>
  </TValues>
  <VerifiableEncryptions/>
</IdmxProof>