<?xml version="1.0" encoding="UTF-8"?><IdmxProof xmlns="http://www.zurich.ibm.com/security/idemix" xmlns:xs="http://www.w3.org/2001/XMLSchema" xmlns:xsi="http://www.w3.org/2001/XMLSchema-instance" xsi:schemaLocation="http://www.zurich.ibm.com/security/idemix ../xsd/IdmxProof.xsd">
  <Challenge>90366344338887561603893701450104573747266038072181303459370615200803514110437</Challenge>
  <CommonValues>
    <CommonValue key="gp">78485280485625733211402793534323449321117898710088543846747559831834759431000</CommonValue>
    <CommonValue key="http://www.ngo.org/CredStruct2.xml;someRandomNameMatchingTheOneInTheProofSpec">8889242831197853012444890279065527828627603325193476775358495186421237102614889017367180336150071925794103375860644047399573303505379451234031883367293930093636703787829400656667036214213973437075612305864967633125813971734897488157942078946230922765749669193260854528097465175875893658926907766224782660797</CommonValue>
    <CommonValue key="http://www.ngo.org/CredStruct2.xml;someRandomNameMatchingTheOneInTheProofSpec;issuerPk">36208523169489658024847489255733158291125038638410703786015367110824921513092</CommonValue>
    <CommonValue key="http://www.ngo.org/CredStruct3.xml;someOtherRandomNameToMakeItDistinct">39047769446690448590646416736693234222907158979406450022915241530425282168681559632861371924549507869257741096567148470762931338985619069138837223645424307741681360739706270361863482642679845147719306713555651419258023455300371374994707229468095630239821184174278928505723483616872950971089124456628010896547</CommonValue>
    <CommonValue key="http://www.ngo.org/CredStruct3.xml;someOtherRandomNameToMakeItDistinct;issuerPk">36208523169489658024847489255733158291125038638410703786015367110824921513092</CommonValue>
    <CommonValue key="http://www.ngo.org/CredStruct3.xml;someRandomNameMatchingTheOneInTheProofSpec">25084210398414836689263111805242996696445126558650246929448458461293783392050943570111692220164780687639859399661672595273951215455559365889123135671100512843114965990691953979925250524140303218678159760538144465803078481171960035220013523840927681317005022882154395789060437606735965937675943261599707758134</CommonValue>
    <CommonValue key="http://www.ngo.org/CredStruct3.xml;someRandomNameMatchingTheOneInTheProofSpec;issuerPk">36208523169489658024847489255733158291125038638410703786015367110824921513092</CommonValue>
    <CommonValue key="proofSpecHash">76085275903874416013378714996515243184501471169726125730677078674585901654338</CommonValue>
    <CommonValue key="sp">19313454934015494502853372660485364277088851954979011267331898025266929871326</CommonValue>
  </CommonValues>
  <Values>
    <Value key="id2" type="BigInteger">1314</Value>
    <Value key="http://www.ngo.org/CredStruct3.xml;someRandomNameMatchingTheOneInTheProofSpec" type="SValueProveCL">
      <SValueProveCL>
        <eHat>-40502231149276035694228467035787294354640935957562316313761654447665549373131103700024314166449173262649614863860526991639149200207719711538565462004131852585681182573338008823</eHat>
        <vHatPrime>-18008176806711011264267058691143760960699763216871943806681678232677144269239017511225310407559145696553091441317423402372652896378401376037686375195049431499559726288095204500552974823225624897288563361668858535153101163694678942201350521767512581704361882383038728319608948158083995453257183641005241490134982117834044623119095646647097982382314192410366365336457691881207849831694257387708102238547280601425051729763777898336907517454809517677263031988632449975337285163229703309428186121747202227679518450470013533042050950575405882682099794249326005993977405918086670302517775558182</vHatPrime>
      </SValueProveCL>
    </Value>
    <Value key="id1" type="BigInteger">1313</Value>
    <Value key="id6" type="BigInteger">1318</Value>
    <Value key="id5" type="BigInteger">1317</Value>
    <Value key="id4" type="BigInteger">1316</Value>
    <Value key="id3" type="BigInteger">1315</Value>
    <Value key="http://www.ngo.org/CredStruct3.xml;someOtherRandomNameToMakeItDistinct" type="SValueProveCL">
      <SValueProveCL>
        <eHat>-77119374977447603252375143810673186230052562470601916872804203277580333526205793531173294912803062674490127286990792462313355035422224917300336369498691081741304007369344122685</eHat>
        <vHatPrime>-3634655184882999680831398579707894650833093243009841372528595699934734508550171176271897407056577226300345376329489020101423694382064003689183212853572347073613265972671487652393791236294868928661049892391416800525316525298495788622752074665140317081185519419641521604132757285480431838579093461659520976807461108004186666098486032400175302242087369318451288165005499939092566476670644143488471232610571060487306139689890339251336343629799385996964066509227455162854761477452787970050367989648090707545609140361128247634157730698019637342026635063132156540352464869265955313839329809926</vHatPrime>
      </SValueProveCL>
    </Value>
    <Value key="http://www.ngo.org/CredStruct2.xml;someRandomNameMatchingTheOneInTheProofSpec" type="SValueProveCL">
      <SValueProveCL>
        <eHat>-61337225236069050488698314114812519865508642077856517299082949886026747473999530423910116709759208726451965417184444896008953098056032887651582735106465400157943385881873175297</eHat>
        <vHatPrime>-8257835230900448952428379926522803320018097513102690684641338234738097012496511196360554971211786335069501573561127728609252112742616678546862137213894568280097363833792625152143577928886742630941331916281887344212692131663567405104527002083070958648309270528014939710235147748655211323155770454128298667591807654452224589605212644093760850473127067779455263774722120552237644475573471549244859033015845133566377294022972914337185309138673172596140820532053631906099702667411233253580502384464044153775817387406132310575223607842359034850934546608229838320360821787605636659338012531528</vHatPrime>
      </SValueProveCL>
    </Value>
  </Values>
  <TValues>
    <TValue>80528601841934306575510176760379067140129897367801710774144669885731251727225160241606700708721480555972920351882119297632924989819961794057896554809574244844824696023548033480115904315837270498086897148635125445063517584797425928786019113541381814773981651962325143527426768044006055825667144497232130800923</TValue>
    <TValue>60383052051424641472151297912727588964187233758670504642869970471723283869728597565305925880994299056931398039062716700770820993045515736741171247258061925355227851526488524343054677200414469573219641570492453686584075113661967914929149993101146777358018175234291907122319388734971093550250411824040742998414</TValue>
    <TValue>32176049265261898373081077077107466111042157189375146191241705448306926307774922350258323004873198433056716663697391522919479369300778433468551938405939194566825933156010080331358656655194654121830604711982219590727422429359275660088027343842409653166301057192808550733890942146632496584985764895947131382678</TValue>
  </TValues>
  <VerifiableEncryptions/>
</IdmxProof>