<?xml version="1.0" encoding="UTF-8"?><IdmxProof xmlns="http://www.zurich.ibm.com/security/idemix" xmlns:xs="http://www.w3.org/2001/XMLSchema" xmlns:xsi="http://www.w3.org/2001/XMLSchema-instance" xsi:schemaLocation="http://www.zurich.ibm.com/security/idemix ../xsd/IdmxProof.xsd">
  <Challenge>115736883427394239017951909374277519946238351091318445707431963554196787234436</Challenge>
  <CommonValues>
    <CommonValue key="gp">78485280485625733211402793534323449321117898710088543846747559831834759431000</CommonValue>
    <CommonValue key="http://www.ngo.org/CredStruct0.xml;someRandomName">110872554347409395466821547418158596859588926919416071434755376314975447108666115766346751248807612762429942209134028362932455260511533347106497511419012926722437432363843288113834228483278131246630914026687258775368151892532092483251076466464592896935441965221091487822723549569301172561748016792875152132712</CommonValue>
    <CommonValue key="http://www.ngo.org/CredStruct0.xml;someRandomName;issuerPk">36208523169489658024847489255733158291125038638410703786015367110824921513092</CommonValue>
    <CommonValue key="proofSpecHash">106273054827501621825553214256000356512999714724107011085366830276057952479094</CommonValue>
    <CommonValue key="sp">19313454934015494502853372660485364277088851954979011267331898025266929871326</CommonValue>
  </CommonValues>
  <Values>
    <Value key="http://www.ngo.org/CredStruct0.xml;someRandomName" type="SValueProveCL">
      <SValueProveCL>
        <eHat>-63206176126006754523135018337400689058444612730139812519926320989505168959633005633931550695301183661687903201368972087129456430291598052999269542827563409044852466263139449785</eHat>
        <vHatPrime>-8336556732968160614509933252385255477838740249767843226862776943036043432674316581878339524469135137221249341646562335791358823648332266683120964717630100572149908298523852682053422009144045141961952685895283618713563035442334526903792231234587427190009009156694866490986626043373175955361486799931586054367262276445385299269287248989214456621784445586821910423940645437561782056506406494821441549366686428590614013181042699153917976929327300520086632447528019483177344319466174493836226691734249400446589293069259185626536724580066225277302099936102232902511844540806335953783178358097</vHatPrime>
      </SValueProveCL>
    </Value>
  </Values>
  <TValues>
    <TValue>106972397973019779934736719960042536527923540267218740122689467318580657185284384811489347787290390319969650107980792353461428390321665832238444039945474403193656046855999278790355943477523484011649055597124743413354159570874359286986294108993231322144917462491670136422546213312919952256615444470418465178358</TValue>
  </TValues>
  <VerifiableEncryptions/>
</IdmxProof>