<?xml version="1.0" encoding="UTF-8"?><IdmxProof xmlns="http://www.zurich.ibm.com/security/idemix" xmlns:xs="http://www.w3.org/2001/XMLSchema" xmlns:xsi="http://www.w3.org/2001/XMLSchema-instance" xsi:schemaLocation="http://www.zurich.ibm.com/security/idemix ../xsd/IdmxProof.xsd">
  <Challenge>1337</Challenge>
  <SmartcardNonce>AAABA4CBAAA=</SmartcardNonce>
  <CommonValues>
    <CommonValue key="gp">78485280485625733211402793534323449321117898710088543846747559831834759431000</CommonValue>
    <CommonValue key="proofSpecHash">110235385455268413038339044356950770279552013381599310803714061398052471783956</CommonValue>
    <CommonValue key="sp">19313454934015494502853372660485364277088851954979011267331898025266929871326</CommonValue>
    <CommonValue key="toBeIssued">24710151076209636170329704183424777377782608751230222351490834940935742686068196176959331202554795798370265588254378593893077024593543181806382809733145023056567607316489219558295449890150491623584971202819395179555857645933213335727435155500288245278591923158359268186549263493150730497093684401870731083778</CommonValue>
    <CommonValue key="toBeIssued;issuerPk">36208523169489658024847489255733158291125038638410703786015367110824921513092</CommonValue>
  </CommonValues>
  <Values>
    <Value key="smartcard_secret;nameOfSecret" type="BigInteger">1788176471760</Value>
    <Value key="id2" type="BigInteger">2000</Value>
    <Value key="id1" type="BigInteger">1000</Value>
    <Value key="id6" type="BigInteger">56491895304619289587312186104712572435684968796075710106727686313227820620699689360036430151867644153426681081813588438973551598190297048351199761292257113335385907843719221894</Value>
    <Value key="id5" type="BigInteger">12935343322792943415181660527480777066044519757845240939579574401511679535004900748121798965350367364806634108925964934711106246342105635319458755329887125907527386698538992168</Value>
    <Value key="id4" type="BigInteger">20745969024660992141199299377999592937509877369926111940566869898553610355295432425717115182994226688612118860791827923144181925980679243907775653288899401607168093393425328504</Value>
    <Value key="id3" type="BigInteger">6000</Value>
    <Value key="toBeIssued" type="BigInteger">895314282616979059877009196565398405279070424226298001055327668278409356906618840878726129097783138314110277743452012464350345447306155806852828131376895744117438305034467774292763037377783056980722547538837719919755804838263266522588611127115091840812742525828755749681880169778234126931355718029130575557434919108313967877478576004908957471129092002581488296456727297143335142891430998163216588080132563691553980891151579393689541</Value>
  </Values>
  <TValues>
    <TValue>85365527820054022147704396748702074484280588045678623554442271821705952331457042628909688343408962302920572922600851190254260595021053045342735013867942257963299774189182472671195463923696618068303205251082340735953110570328945707734682640560223668806611955496571119540188422172446726409564986399948269994722</TValue>
  </TValues>
  <VerifiableEncryptions/>
</IdmxProof>