<?xml version="1.0" encoding="UTF-8"?><IdmxProof xmlns="http://www.zurich.ibm.com/security/idemix" xmlns:xs="http://www.w3.org/2001/XMLSchema" xmlns:xsi="http://www.w3.org/2001/XMLSchema-instance" xsi:schemaLocation="http://www.zurich.ibm.com/security/idemix ../xsd/IdmxProof.xsd">
  <Challenge>43432846806140296189744912369782690256873582036103115540138701548678225748626</Challenge>
  <CommonValues>
    <CommonValue key="gp">78485280485625733211402793534323449321117898710088543846747559831834759431000</CommonValue>
    <CommonValue key="http://www.ngo.org/CredStruct5.xml;someRandomNameMatchingTheOneInTheProofSpec">27835993612678455121356366761627511471961637655894710593877733995690764413724743246582849009122807932926636950314148326979153752389465946493880514136478705291682492647899756968001712418965875298458999176465335325843470965544323894051924348206351195697078676948833667217568186356825509770048179992410252821460</CommonValue>
    <CommonValue key="http://www.ngo.org/CredStruct5.xml;someRandomNameMatchingTheOneInTheProofSpec;issuerPk">36208523169489658024847489255733158291125038638410703786015367110824921513092</CommonValue>
    <CommonValue key="id1;NOT">104807522603692207725070758923248165257047209405340872133773778912969524286193191661947701510423383087039669630184984005171870913102478219424509035656425182132030025930986976172826472946874544238396799695898131273679455424147195074570561767904601366593092452339864827165497490297481141967004965149976439520984</CommonValue>
    <CommonValue key="id2;NOT">19695031008394640896084907521082224545672512853786442475099088715026964386868716611478414730850004816980756282928865548432434125345934457177502118494748829526480655456132586775905206778153756937957414395873723850333355244967129067260407215039619655729953248083940291730252448509721501406014301544181041049593</CommonValue>
    <CommonValue key="proofSpecHash">46675211165942090672716661574690282831231834750944021768352506659382399784662</CommonValue>
    <CommonValue key="sp">19313454934015494502853372660485364277088851954979011267331898025266929871326</CommonValue>
  </CommonValues>
  <Values>
    <Value key="id1;NOT:rHat" type="BigInteger">28312786171133035885478333026783719077253929774481825452522416889177146960837756318946521384812295899443901367582897236599719122362735757500715531560053500569924061893707800714243525868413029173499408486821645469046081993104071409553274649336382499873449459645561393810352184195026035378742926458432419266573862203510110461481235979153876732286104498063016902897173309787298206258600649450439644978488760029</Value>
    <Value key="id2;NOT" type="SValueCGNOT">
      <SValueCGNOT>
        <aHat>-2994885924564533386746808614910353151187568327388406406521671861659807875765262336597089261530694027794267570961690528662081930444867987421796075219938062913046294361440</aHat>
        <bHat>-2016733070748829394301159876166536167508094363295123079785237644797639526718906437904982492774431507487115606896197841505010479918803102200705000339555795348169790122735</bHat>
        <rHatPrime>-2437293761385945549838546066669730121076439307215217208681726316732960812162330278071585114949340799849349501018401325843546791713125754639620115986761497975703335571645736046820684758936498212209347240451551356428647205930810314495293946470730869575239289895077758074668285205309585942559158122470890548449915090532279760707180051841646994300151370921114943606140204610442323924084277</rHatPrime>
      </SValueCGNOT>
    </Value>
    <Value key="http://www.ngo.org/CredStruct5.xml;someRandomNameMatchingTheOneInTheProofSpec" type="SValueProveCL">
      <SValueProveCL>
        <eHat>-66999733255382505924068426406557972816810859148535446178599979924816503418800602196240364839468877811434353579078778807158385418673983692804253135878658678398358935322930498362</eHat>
        <vHatPrime>-3354295769850547351439769081222716338507066259579099958020420604565325694263744395991071757397188663751543842058141884860536351205326283510268166774876587300803583460682810504737552724212997666103213508853731642057544983293977103100220489630907983046771114570623315065191180721409672549314895130670159817306047719922276362625760028133905758503010085552562120932341051980765118694793472231925889031709968998806826484617951057908772537214472332244370129285490211222679702310477216066849725529218140826832480708215926066198861565119231138067858239749945679811266400330316137853450582303511</vHatPrime>
      </SValueProveCL>
    </Value>
    <Value key="id2" type="BigInteger">49323314805703122181603295316369265490751235189760784789689379805882377396399234010088836519563640493634688699793409217017744485733646853449652768810860787946011223712893237312</Value>
    <Value key="id1" type="BigInteger">16144871980700660025381968522153538690960974196012843258168310561991752743180011219387414344183795789980056170053471770416857232051697540621761115244863194368752707533436158831</Value>
    <Value key="id1;NOT" type="SValueCGNOT">
      <SValueCGNOT>
        <aHat>2551846759921176599855391269936590334239359372746943445605109432353704782427722507126962619324079640715342371361247484976055683549097949373604273114262521</aHat>
        <bHat>1024793990856319786476992621007544989099878056367948765909162705988958954209615908210995476158450245176782698336182692585299507733283260812407564367062997</bHat>
        <rHatPrime>217638204385968037565757237141272778603480853317797757738871311294983381348600242160176464754769120835620275761801273400779125202433453173581145413915209796984067058766381864781088534186968850891114290572600374138202817107802982494314262696556532916054245800162346034298590936987811075507846587930428444178709630438430999403878692768533344129560792177619363848551705542780181288246441320</rHatPrime>
      </SValueCGNOT>
    </Value>
    <Value key="id2;NOT:rHat" type="BigInteger">37899946492688999173028857037962330286000038615802557690071747981884386133944271703566343001895809263644320760450625471732621603915275108415125193575241636811336958453056576328158870806484934996543022255030808180157076496976747207729225968056499069615046120818010981493981857856624030965051882209008669269686179903677534727508145346188600623807643785346147335260359906829099446822941518148878364581877379385</Value>
  </Values>
  <TValues>
    <TValue>108251707211408600954583882222742705588764991417559262168810595440522572575944668673423392717968793333175582118430385303433819459213347621149427537265646743501140355107107397791093321709386830432636242036695399027047333346782741533441687918357928828643907164832443047879369590645696952914460856216863876472476</TValue>
    <TValue>112171155738715684357538592313541407696008979264857846339107506877260816578982094946593288799105138822534886868163971492312807231416649766737908940430147363211760275362255664512028475348323635404789566148914468083278751892570352853105716209008182396948568709314663321170652132821398459275179989787037906466845</TValue>
    <TValue>3762933866977063745822522195084508588041613924297506357266688131952316242614817665478699084484138447951203970645829232464069260381932188670225216784326844337147130850023009540748336082019270030829254346000993462120765666351017027646381495384843729827684851976069363563258001798795996122289983001887132093714</TValue>
    <TValue>61434810492638479677282444071773828578063205299827377172228257453961060717984044312654984551607459709042850577519980452871450885202557435369951601620920889194188539797779730541918102024205556812415219339187953899669825569947504379132613493104680181676474512370317732826179712069657264343567129276685308878479</TValue>
    <TValue>59973559990003881565672643617956837871012112228529581816434990113392417985246385103578962661941753924549274514757918036698304241203770531783778249065034868344252750679204803584442379454161362236690597791687207997239024258250191196261493325354511385965658711499033282485358349090518006584924359079400187262569</TValue>
  </TValues>
  <VerifiableEncryptions/>
</IdmxProof>