<?xml version="1.0" encoding="UTF-8"?><IdmxProof xmlns="http://www.zurich.ibm.com/security/idemix" xmlns:xs="http://www.w3.org/2001/XMLSchema" xmlns:xsi="http://www.w3.org/2001/XMLSchema-instance" xsi:schemaLocation="http://www.zurich.ibm.com/security/idemix ../xsd/IdmxProof.xsd">
  <Challenge>1337</Challenge>
  <SmartcardNonce>AAABA4CBAAA=</SmartcardNonce>
  <CommonValues>
    <CommonValue key="Hello">283671287502675738745401252960954002323362114949843197098753625953143812250936914852448844380531839006468254115829793365275737648337751482364836916865863744170430144017199278520440744015572302261701143281801317756246422722530920577</CommonValue>
    <CommonValue key="gp">78485280485625733211402793534323449321117898710088543846747559831834759431000</CommonValue>
    <CommonValue key="proofSpecHash">41398922248911251744702577397755864786374992717503208545595873930621697205449</CommonValue>
    <CommonValue key="sp">19313454934015494502853372660485364277088851954979011267331898025266929871326</CommonValue>
  </CommonValues>
  <Values>
    <Value key="Hello" type="BigInteger">1935130224482251007174551801011074472257148951587271531436185639953658540272644688991609089576755139428034312409248223037760148374727548350627589446988106976695202620417357438736909990305327059504521029923948781434966199588765183660263997469963797037806890725022818955590433032362005724623310098472638174350804429135163093490579</Value>
    <Value key="smartcard_secret;blibli" type="BigInteger">1788176471760</Value>
  </Values>
  <TValues>
    <TValue>243886358145584953430168609507832142799757610633050005762221448678765613225891301004006530662556458512829116985246681781262701600608270235891383855032942277441339027450510179245187873089726272939881745074668732221685217065504749930</TValue>
  </TValues>
  <VerifiableEncryptions/>
</IdmxProof>