<?xml version="1.0" encoding="UTF-8" standalone="no"?>
<IdmxProof xmlns="http://www.zurich.ibm.com/security/idemix" xmlns:xs="http://www.w3.org/2001/XMLSchema" xmlns:xsi="http://www.w3.org/2001/XMLSchema-instance" xsi:schemaLocation="http://www.zurich.ibm.com/security/idemix ../xsd/IdmxProof.xsd">
  <Challenge>82107730514712836260049201115941670629797596404343305771559251535999784593533</Challenge>
  <CommonValues>
    <CommonValue key="gp">78485280485625733211402793534323449321117898710088543846747559831834759431000</CommonValue>
    <CommonValue key="http://www.ngo.org/CredStruct2.xml;someRandomNameMatchingTheOneInTheProofSpec">112832893050429709445392855311005436983103515407661191445851650808522389859333221484126088433869540411095304632340667759667287405042543639211344745379768634279602798225579649411537016610763874248372791996848497622329890079312488523050643347149278684087516920256810354698677625277310581094941178184942431753206</CommonValue>
    <CommonValue key="http://www.ngo.org/CredStruct2.xml;someRandomNameMatchingTheOneInTheProofSpec;issuerPk">36208523169489658024847489255733158291125038638410703786015367110824921513092</CommonValue>
    <CommonValue key="http://www.ngo.org/CredStruct3.xml;someRandomNameMatchingTheOneInTheProofSpec">110191413528255000047635337199272035375912755620620869427805221829611960258132829175673748062033731624612040068296618945970508516010789967058499271181284533381432727334349951845623171111220371604196530192849461025929060798849410494577297752022404476134091481088931757137726346785066034855262827914221028403126</CommonValue>
    <CommonValue key="http://www.ngo.org/CredStruct3.xml;someRandomNameMatchingTheOneInTheProofSpec;issuerPk">36208523169489658024847489255733158291125038638410703786015367110824921513092</CommonValue>
    <CommonValue key="proofSpecHash">85619916305949345377151666090148212812462964163229421362053076839589101873610</CommonValue>
    <CommonValue key="sp">19313454934015494502853372660485364277088851954979011267331898025266929871326</CommonValue>
  </CommonValues>
  <Values>
    <Value key="http://www.ngo.org/CredStruct2.xml;someRandomNameMatchingTheOneInTheProofSpec" type="SValueProveCL">
      <SValueProveCL>
        <eHat>91962832989205574716045064481535122399765220930447826213002923040389349581263863444496412285620901299118454534430775852596158579159441601485804079246848470138608933117097471502</eHat>
        <vHatPrime>-15778497126878829677766482408285413613067190766535343289447189045564887785989595185195721438888395824843496228901873707724153231571668081999207674534154616818872011756517976828837714327479127465088502863994175288698846458513379807520765357761991536441429724886854742832153416899703740459156062373233903714818193905152809698613024352752858248990614236108012165587506212301762259363677030598022019205339578788721429310351356830127215673358902017764447564536183913129257404264077396113526589326531889035255928176640968921631912794479185239227227168747828285650512319159607238799124454955393</vHatPrime>
      </SValueProveCL>
    </Value>
    <Value key="http://www.ngo.org/CredStruct3.xml;someRandomNameMatchingTheOneInTheProofSpec" type="SValueProveCL">
      <SValueProveCL>
        <eHat>-27416351990645219979661399982437457391470164373657433675539161035292907670686736323497332719091860258703378961075420619619223582913026398797327876492681989219311093522512627471</eHat>
        <vHatPrime>-9091217486973575635177516170009880571769111812064202242721649628493971481708041577313383647089949886969488734532723013015904001781768000486415496556644214324377113033542031028850784323704371768812960188627531795185546498356223206925034874220463545469116375096814681243839603034258694514576308657119086479819859708595252643633946806292796314434011694387087520337459868703057095700153669917263510210294068149272602694907418792694150574586406510002262300086293757301084699316861601647638127882836289240031955103434845551027149340361189368644276294243721747351730968842314248339822709078499</vHatPrime>
      </SValueProveCL>
    </Value>
    <Value key="id2" type="BigInteger">1314</Value>
    <Value key="id1" type="BigInteger">29423402028423286945257748157214028185364526361354068645999351956849375064969649650915988295245582016952866536695929979800836542528706150120006707649587820122066092494084497392</Value>
    <Value key="id4" type="BigInteger">1316</Value>
    <Value key="id3" type="BigInteger">19156012344259771623430490973271987300820648591041728420050774763634974092029184588974723279435616517931125914312783742741354336618020511928021944945779615796695104933450067898</Value>
    <Value key="again a random name" type="BigInteger">70933647660275679324429428470197412334942797947557946401989214652013057278020664272095650272185751678802888077184482860332184847822033658619556068908791484587325251855072760627254206721750983582826021706955756020784089234011289476582168050186599601490163594424639285996061142765135116775086047582258064696650432871501747259295798083647173856676747226774255481061100519453445874797555269588258982002546873930</Value>
    <Value key="another random name" type="BigInteger">183776200750726733823435546940895705678296081776673728063430291852829680849972104507624178268351490742315886424398510739292740228379062754284580426165861645818099384993935643697695248205841496652700611354238304616335925543268097468969550048221799333796563881548057264430389047766924956609359745346605396585888528553394776088609772064606588041226348739376705162035407330104091813000534243516119277981379265030</Value>
    <Value key="id6" type="BigInteger">1318</Value>
    <Value key="id5" type="BigInteger">26736132860425499818912539423291550073114972201957847066060347177620901033481963240046493367265296366420943290818323799721706279703864387267059026523631089521185943029981340893</Value>
  </Values>
  <TValues>
    <TValue>83203429407130904576623386642850139862248765398697425574200914711606667480395124243954620932197669145412425939971532383090429789302261558728578780000634843882429235296939379421633253736197680497941658881384793057854427916889286609669885410471481124485322388701834507103489997766189693789899185192550582867850</TValue>
    <TValue>76711587166275269816862017362900659959190423422879112806303871872321839202193950468676512991672577884484953586890215994817503318744144433284237974596455513050347819287373806440378925020700331701495318016311361049669878040275341104413441903688382820850929928196962861056042903305020891376162143056458446372198</TValue>
    <TValue>21377221093861412518323450168727421003147196676302872090822814814682696075142298645414377342919374584659629157521753192325034988146323266140496392627154380618072975659927160503179802801072799703468293604983265515047550299172385423161919356104391905756960211507521421119381658669724161387577383423181902605413</TValue>
    <TValue>3262326576073290850294074292684273367554950031905905426358920452038707639611415172823645142863932525737859306445252624170911949010215646642050655523223413798333814513582970417293449316605069921020744909190481917861209796092623703080027314706292915221105712995068981949175199457870247640740230398608949684352</TValue>
  </TValues>
  <VerifiableEncryptions/>
</IdmxProof>
